Title;Author(s);Year;Publication Title;Type of Publication;Source;DOI;Abstract
Learning Factors for TIMSS Math Performance Evidenced Through Machine Learning in the UAE;"Nadaf A.; Monroe S.; Chandran S.; Miao X.";2023;Lecture Notes on Data Engineering and Communications Technologies;Book chapter;Scopus;10.1007/978-981-19-8040-4_4;Understanding how the UAE K12 education system performs with data-driven evidence is key to inform better policy making to support UAE vision to upskill human capital growth for its economic transformation. In this study, we investigate the potential of using machine learning techniques to understand key learning factors contributing to UAE student math performance on the TIMSS 2019 assessment. Due to the fact that learning factors co-exist and interact with one another, we explore the SHapley Additive exPlanations (SHAP) approach to explain the complexity of the model. The results highlight the importance and contributions of each learning factor and uncover the relationships between the learning factors. Understanding key learning factors and identifying evidence-based intervention opportunities will help policymakers with informed education intervention designs to improve student mathematics learning, in order to improve UAE student TIMSS math performance over the long run. © 2023, The Author(s), under exclusive license to Springer Nature Singapore Pte Ltd.
Artificial Intelligence in Secondary Education: An Innovative Teacher’s Tool to Ensure Individualised Learning for Students;"Lytvynova S.; Vodopian N.; Sysoeva O.";2024;Communications in Computer and Information Science;Conference;Scopus;10.1007/978-3-031-63235-8_26;In recent years, the digital transformation of society has characterised access to the Internet as a prerequisite for educational activities. Artificial intelligence (AI) has opened up new opportunities for developing individualised learning for students. A 2023 study analyses the results of using artificial intelligence by teachers of Ukrainian secondary schools. The main goal of the survey is to determine the state of AI applications for individualised learning and the integration of this technology into pedagogical practice. The study examines the timing of digital technology implementation and its impact on the continuous development of teachers’ digital competencies. Particular attention is paid to the aspects of AI implementation, including educational purposes, teacher readiness, and limitations of this technology. It is established that to implement individualised learning, the goal and objectives of individualisation, the choice of AI services and platforms, opportunities for students, security measures, learning pace, level of mastery of the material and personal interests should be considered. The author proposes a classification of tasks for students using AI and provides examples of assessments for students of grades 7–9 in English, mathematics, and biology. Emphasis is given to the fact that AI-powered automatic assessment enables the recognition of the requirements of every individual student and adapts learning tasks according to their current abilities and knowledge. Despite the challenges and problems of integrating AI into the school environment, the study points to the growing interest of teachers in this technology, the improvement of AI capabilities, and its gradual development as a teacher’s assistant. © The Author(s), under exclusive license to Springer Nature Switzerland AG 2024.
Evaluating Productivity of Learning Habits Using Math Learning Logs: Do K12 Learners Manage Their Time Effectively?;"Hsu C.-Y.; Horikoshi I.; Li H.; Majumdar R.; Ogata H.";2024;Lecture Notes in Computer Science (including subseries Lecture Notes in Artificial Intelligence and Lecture Notes in Bioinformatics);Conference;Scopus;10.1007/978-3-031-72315-5_12;Habits refer to behaviors that occur repetitively. As ICT tools spread widely in learners’ school lives, the Learning Analytics (LA) techniques enable researchers to monitor learners’ daily activities and understand their habitual behaviors via fine-grained analysis of the log data that traces one’s actions in digital environments. While types of learning habits were commonly evaluated with academic performance, little evaluation focused on whether the existing habit types involve high learning productivity. Therefore, this study evaluates the productivity of habit types using effective time management factors, including effectiveness, efficiency, and effortlessness. We collected learning logs from 114 learners at the age of 15 on average in a Japanese junior high school. Specifically, we analyzed their self-directed learning of doing math exercises from Apr. 2022 to Feb. 2023. The findings strengthen the importance of teaching and learning process through a better time management strategy in terms of building learning habits, where many students face difficulties. As the implications of this study, we could support learners in time awareness and time adjusting by recommending an appropriate type of learning habits considering its productivity. Hence, the regular scheduling of learning activities can not only improve the learning productivity of learners but also cultivate skills of self-directed learning with effective time management. © The Author(s), under exclusive license to Springer Nature Switzerland AG 2024.
AI-based Learning Assistants: Enhancing Math Learning for Migrant Students in German Schools;"Kretzschmar V.; Seitz J.";2024;Proceedings - 2024 IEEE Conference on Artificial Intelligence, CAI 2024;Conference;Scopus;10.1109/CAI59869.2024.00035;"Increasing migration leads the education landscape to face the challenge of integrating children into the school system, accounting for inherent disadvantages. On average, as nearly half of them face socio-economic disadvantages, a persistent performance disparity was observed compared to domestic students. Remarkably, even after mitigating the influence of socioeconomic status, immigrant students' scores remained inferior. From March to May 2023, the AI Education (AIEDN) research project investigated how an AI-based learning assistant can compensate for existing impediments by enabling a better understanding through video-based learning. For this study, 275 students were selected from two secondary schools (N=137) and two grammar schools (N=138) in Baden-Württemberg, Germany. The experiment tested the extent to which learners solve more tasks, build broader (transfer) knowledge, and retain it. Students were repeatedly tested on mathematical problems, where the control group did not have access to the AI assistant. In contrast, the other group used the AI assistant to solve the problems. The students' performances from both school groups were statistically tested using t-tests. Within the test group of grammar schools, a significant change in the results between the two test days existed (T(41)=-2,28; pc.01) when the AI tool was used. In contrast, the control group showed no significant change T(37)=-.42; p>.05; d=.O7) in performance. However, the results were insignificant for the secondary school students, as the given tasks and video content were considered too demanding. Further research is needed to determine AIEDN's performance for other target groups. © 2024 IEEE."
Research on Knowledge Graph Extraction Methods for Chinese STEM Curriculum;"Wang C.; Sang X.; Wang X.; Gao Y.; Liu Y.";2024;MLNLP 2024 - 2024 International Conference on Machine Learning and Natural Language Processing;Conference;Scopus;10.1109/MLNLP63328.2024.10800180;STEM education, as an innovative teaching model, has gained widespread attention in recent years. However, the lack of relevant textBooks and learning resources has made its implementation challenging. Developing interdisciplinary knowledge graphs tailored for STEM education has become an urgent issue. To address this, a knowledge extraction framework named Llms4edu is proposed, which utilizes a series of effective prompts to guide large language models in knowledge extraction. Specifically, the knowledge extraction task is transformed into multiple rounds of question-and-answer interactions with the LLM, gradually identifying entity-relation triplets from subject data. Through experiments, an F1-score of 89.4% was achieved on the named entity recognition task in the chemistry subject, and an F1-score of 66.7% on the relation extraction task. Finally, a subject ontology model was built for subject text, and a subject data set was constructed using Llms4edu, which includes three subjects of junior high school mathematics, physics, and chemistry, a total of 2,511 entities, 2,010 relationship triples, and cross-disciplinary knowledge is linked to construct a cross-disciplinary knowledge graph. © 2024 IEEE.
Assessing the effectiveness of an artificial intelligence tutoring system for improving college-level mathematics preparedness in high school students;"Nehring J.; Moyer-Packenham P.; North M.";2023;Issues in Information Systems;Article;Scopus;10.48009/1_iis_2023_111;Intelligent Tutoring Systems (ITS) have been used to help high school students transition from the mathematics taught in high school to the mathematics expected at colleges and universities. The purpose of this study was to examine relationships between high school students’ performance in Assessment and LEarning in Knowledge Spaces (ALEKS) Placement, Preparation, and Learning (PPL) Modules and performance on the ALEKS College Mathematics Placement Exam. The participants in this study were 100 students from five high schools in the United States. Each student was placed into one of two groups: the ALEKS Group, who completed the ALEKS Pre-Calculus Learning Modules, and the Non-ALEKS Group, who did not complete the modules. Students’ scores were compared statistically to test for significant differences. The analysis included a 2x2 mixed ANOVA to measure how assignment of the modules affected exam scores. A logistic regression was used to assess differences between the two groups in placing into college algebra. A statistically significant difference was found in exam scores between the ALEKS Group and the Non-ALEKS Group which indicated that assignment to the ALEKS PPL Pre-Calculus Learning Modules did increase performance on the ALEKS College Mathematics Placement Exam. Conversely, assignment to the ALEKS PPL Pre-Calculus Modules did not increase students’ likelihood of placing into College Algebra. The amount of time students spent taking the exam influenced student outcomes on the ALEKS Mathematics Placement exam. These results show that schools could implement Intelligent Tutoring Systems into their current mathematics classrooms to help students increase their scores on college entry mathematics placement exams. © 2023 International Association for Computer Information Systems.
Novel Feature-Based Difficulty Prediction Method for Mathematics Items Using XGBoost-Based SHAP Model;"Yi X.; Sun J.; Wu X.";2024;Mathematics;Article;Scopus;10.3390/math12101455;The level of difficulty of mathematical test items is a critical aspect for evaluating test quality and educational outcomes. Accurately predicting item difficulty during test creation is thus significantly important for producing effective test papers. This study used more than ten years of content and score data from China’s Henan Provincial College Entrance Examination in Mathematics as an evaluation criterion for test difficulty, and all data were obtained from the Henan Provincial Department of Education. Based on the framework established by the National Center for Education Statistics (NCES) for test item assessment methodology, this paper proposes a new framework containing eight features considering the uniqueness of mathematics. Next, this paper proposes an XGBoost-based SHAP model for analyzing the difficulty of mathematics tests. By coupling the XGBoost method with the SHAP method, the model not only evaluates the difficulty of mathematics tests but also analyzes the contribution of specific features to item difficulty, thereby increasing transparency and mitigating the “black box” nature of machine learning models. The model has a high prediction accuracy of 0.99 for the training set and 0.806 for the test set. With the model, we found that parameter-level features and reasoning-level features are significant factors influencing the difficulty of subjective items in the exam. In addition, we divided senior secondary mathematics knowledge into nine units based on Chinese curriculum standards and found significant differences in the distribution of the eight features across these different knowledge units, which can help teachers place different emphasis on different units during the teaching process. In summary, our proposed approach significantly improves the accuracy of item difficulty prediction, which is crucial for intelligent educational applications such as knowledge tracking, automatic test item generation, and intelligent paper generation. These results provide tools that are better aligned with and responsive to students’ learning needs, thus effectively informing educational practice. © 2024 by the authors.
Artificial Intelligence for Personalized Learning in K-12 Education. A Scoping Review;"Pitrella V.; Perna S.; Allegra M.; Gentile M.; Ottaviano S.; Re A.; Tosto C.; Città G.";2024;Communications in Computer and Information Science;Conference;Scopus;10.1007/978-3-031-67351-1_25;The ongoing evolution of Artificial Intelligence technology is able to influence different fields of human experience, also including communication and professional activities. Artificial Intelligence has been playing a relevant role in education and literature has already addressed the design, impact, and challenges of such technological solutions designed for educational purposes. On the other hand, technology integration, and especially the integration of solutions related to Artificial Intelligence, has started to exert a crucial function in enabling and enhancing Personalized Learning experience. In this regard, the present paper Reports the results of a scoping review conducted with the aim of describing the empirical research evaluating the impact of Artificial Intelligence tools and systems as integrated in Personalized Learning approaches designed for K-12 education. The results shows that personalized solutions supported by Artificial Intelligence technology mainly consisted in Intelligent Tutoring Systems designed for online learning platforms and addressed STEM (especially Mathematics and Physics topics) and language learning. Overall, all the studies selected for the purposes of the current reviews Reported a positive impact of the Artificial Intelligence-based personalized systems on students’ learning outcomes. © The Author(s), under exclusive license to Springer Nature Switzerland AG 2024.
Feedback in Online Mathematics Tutoring;"Jan?a?ík A.; Michal J.; Novotná J.";2023;International Conference on Computer Supported Education, CSEDU - Proceedings;Conference;Scopus;10.5220/0012017500003470;The goal of this paper is to present issues related to assessment and feedback in the framework of online mathematics tutoring implemented with the help of a chatbot using Artificial intelligence (AI) (Jan?a?ík et al., 2022). The presented project aims to create a teaching course that is intended to help the pupil in independent preparation for the national entrance exams in mathematics for upper secondary schools in the Czech Republic. The course takes the form of a chatbot with which a pupil can communicate in a web browser environment or the Telegram communication application designed for all common operating systems (Windows, macOS, Linux, iOS, Android, ...). The chatbot also includes a communication module using artificial intelligence that can communicate with the pupil beyond the scope of the designed course. The following two questions are addressed in the part of the research that is presented in this paper. The first question is what form of feedback is effective in the given environment and most reflect the nature of tutoring. The second question is how the chosen procedures must be modified for the different areas of mathematics the course focuses on. The paper presents an implementation within the area of algebra and geometry. Copyright © 2023 by SCITEPRESS – Science and Technology Publications, Lda.
Vik's Adventures: Enhancing Mathematical Learning in Secondary School Students Through a Serious Game Integrated with a Deep Learning Model;"Lussine C.P.S.; Yaquelin M.A.L.; Elio N.V.";2024;Proceedings of the 2024 IEEE 4th International Conference on Advanced Learning Technologies for Education and Research, ICALTER 2024;Conference;Scopus;10.1109/ICALTER65499.2024.10819208;The integration of deep learning and serious games within educational frameworks offers innovative pathways to enhance student engagement and learning outcomes. This research presents a serious game in a web application designed to improve mathematical skills among first-year secondary school students in Peru. The project employs advanced deep learning techniques to personalize learning paths based on individual performance metrics. Using a dataset of diagnostic responses, our model achieved 84.1 per cent accuracy after 50 training epochs, indicating significant potential for personalized education. The findings highlight the effectiveness of combining gamification with deep learning to transform educational practices and address learning disparities. © 2024 IEEE.
A Spatiotemporal Analysis of Teacher Practices in Supporting Student Learning and Engagement in an AI-Enabled Classroom;"Karumbaiah S.; Borchers C.; Shou T.; Falhs A.-C.; Liu P.; Nagashima T.; Rummel N.; Aleven V.";2023;Lecture Notes in Computer Science (including subseries Lecture Notes in Artificial Intelligence and Lecture Notes in Bioinformatics);Conference;Scopus;10.1007/978-3-031-36272-9_37;Research indicates that teachers play an active and important role in classrooms with AI tutors. Yet, our scientific understanding of the way teacher practices around AI tutors mediate student learning is far from complete. In this paper, we investigate spatiotemporal factors of student-teacher interactions by analyzing student engagement and learning with an AI tutor ahead of teacher visits (defined as episodes of a teacher being in close physical proximity to a student) and immediately following teacher visits. To conduct such integrated, temporal analysis around the moments when teachers visit students, we collect fine-grained, time-synchronized data on teacher positions in the physical classroom and student interactions with the AI tutor. Our case study in a K12 math classroom with a veteran math teacher provides some indications on factors that might affect a teacher’s decision to allocate their limited classroom time to their students and what effects these interactions have on students. For instance, teacher visits were associated more with students’ in-the-moment behavioral indicators (e.g., idleness) than a broader, static measure of student needs such as low prior knowledge. While teacher visits were often associated with positive changes in student behavior afterward (e.g., decreased idleness), there could be a potential mismatch between students visited by the teacher and who may have needed it more at that time (e.g., students who were disengaged for much longer). Overall, our findings indicate that teacher visits may yield immediate benefits for students but also that it is challenging for teachers to meet all needs – suggesting the need for better tool support. © 2023, The Author(s), under exclusive license to Springer Nature Switzerland AG.
Enhancing the Admissions Process for Engineering Baccalaureate Programs: A Machine Learning Approach to Developing a Valid and Reliable Examination;"Ramos M.S.; Barajas J.R.B.; Gealone P.J.N.; Aspra N.O.; Padua O.M.; Lucero A.T.";2023;2023 Systems and Information Engineering Design Symposium, SIEDS 2023;Conference;Scopus;10.1109/SIEDS58326.2023.10137793;This paper details an approach to identify multiple-choice questions that are most effective in discriminating deficiencies in mathematics competencies of incoming first-year engineering students who are graduates of the K-12 program that was recently implemented in the Philippines. To achieve this objective, machine learning algorithms such as the k-Nearest Neighbors (kNN), Logistic Regression (LR), Random Forest (RF), Decision Tree (DT), and Gradient Boosting Machines (GBM) were implemented. From a question bank containing 1,300 questions covering Algebra (A), Advanced Algebra (AA), Plane and Spherical Trigonometry (T), Analytic Geometry (AG), and Solid Mensuration (SM), five domain experts identified the suitability of the questions as part of a diagnostic examination in mathematics. Specifically, using a 5-point Likert scale (5 being the highest), the experts rated the suitability of each question to test the proficiency of a student in 23 mathematics competencies based on what is prescribed by the Commission on Higher Education (CHED). The collected survey data were then used to train the machine learning models, which extracted patterns to identify the questions that would be most suitable to test the mathematics competencies of incoming first-year engineering students. With a precision recall score of 99.90%, the LR model was selected as the best performing model and analysis of how the LR model predicts the labels through the use of shap values revealed that the preference was given towards questions which test student proficiency in foundational mathematics competencies like that of Algebra and Analytical Geometry. Overall, these findings provided a better understanding of the questions that are most effective in discriminating student deficiencies in mathematics subjects.  © 2023 IEEE.
DIA4K12: Framework for Managing then Teaching-Learning of Artificial Intelligence at Early Ages;"Labanda-Jaramillo M.; Chamba-Eras L.; Erreyes-Pinzon D.; Chamba-Eras I.; Orellana-Malla A.";2022;Lecture Notes in Networks and Systems;Conference;Scopus;10.1007/978-3-030-96293-7_36;"Artificial Intelligence (AI) is intervening positively in educations. UNESCO considers as a new vision to involve AI not only as a didactic medium but also as a science in which children can develop their intellect, through workshops, courses, and curricula focused on the fundamentals of AI, allowing them to develop skills such as computational and critical thinking. This research aims to design the DIA4K12 framework, which proposes the structure to support the teaching-learning process of AI in primary and secondary education. The core of the framework consists of four phases: planning, execution, process, and development; three components: open educational resources, K-12 curriculum and active methodologies; five sublevels: logical reasoning, computational thinking, and disconnected artificial intelligence, mathematics for AI, programming and machine learning; and three transversal axes: communities (communities of practice), open license (creative commons) and ethics. Finally, the framework was applied to a case study in the context of the Ecuadorian General Basic Education curriculum for the subject of Mathematics, using three phases, three components, and two sublevels. © 2022, The Author(s), under exclusive license to Springer Nature Switzerland AG."
A multimodal platform to teach mathematics to students with vision-impairment;"Jariwala A.; Marghitu D.; Chapman R.";2021;Lecture Notes in Computer Science (including subseries Lecture Notes in Artificial Intelligence and Lecture Notes in Bioinformatics);Conference;Scopus;10.1007/978-3-030-78095-1_10;The advancements in Artificial Intelligence (AI) technologies in the last decade have led many developers, universities, and researchers to invest in the research and development of digital teaching platforms. This paper compares existing features implemented in the first prototype and provides visually impaired high-school students with a system to learn and practice mathematical problems. This project describes possibilities provided by open-source APIs such as Natural Language Toolkit (NLTK) and shows how to implement them to make education universal and accessible. We aim to achieve this by introducing an open-source platform, which will provide a set of modules for personalized speech recognition and accessible online tutoring. The system is divided into two modules: First, an intelligent conversational agent to help students learn new mathematical concepts, which opens up possibilities of providing students with a personalized response. Second, a mathematical expression parser and evaluator to help the student practice mathematical questions. The implementation and development of the system shall open doors towards self-directed learning for visually impaired students. © Springer Nature Switzerland AG 2021.
